{
  "schema_version": "2.0-rc1",
  "issue_id": "lab-phase4c-weekly-2026-03-09",
  "research_profile": "WEEKLY",
  "evidence_task_id": "lab-p4c-c1",
  "evidence_sha256": "da2fa4facbddefd913fe0cc47935cfd4b15795f778dd5070599855f149e5891b",
  "materiality": {
    "status": "MATERIAL",
    "rationale": "週内3月13日付のserving報告が問いの中心。方法の新規発表日や当時の即時導入可能性は主張しない。"
  },
  "scope_dimensions": [
    "speculative-inference",
    "speed-interpretation"
  ],
  "profile_annotations": {
    "lab_only": true,
    "window_start": "2026-03-09T00:00:00Z",
    "window_end_exclusive": "2026-03-16T00:00:00Z",
    "historical_webpage_state": "UNATTESTED"
  }
}
