{
  "schema_version": "2.0-rc1",
  "issue_id": "lab-phase4c-weekly-2026-03-09",
  "research_profile": "WEEKLY",
  "evidence_task_id": "lab-p4c-c2",
  "evidence_sha256": "56023794470ec7ebaf3b44c4bc5a5eba96c5ae29e70ba6270ce61a4a488beb3c",
  "materiality": {
    "status": "CONTEXT",
    "rationale": "2月の背景研究だが問いに直接関係し、P-EAGLEだけが並列draft/serving可能という誤解を防ぐ。週内新着とはしない。"
  },
  "scope_dimensions": [
    "speculative-inference",
    "speed-interpretation"
  ],
  "profile_annotations": {
    "lab_only": true,
    "window_start": "2026-03-09T00:00:00Z",
    "window_end_exclusive": "2026-03-16T00:00:00Z",
    "historical_webpage_state": "UNATTESTED"
  }
}
